{
  "relationshiplist": [
    {
      "sub": "Group 123",
      "rel": "At The Controls",
      "rel_type": [
        "controls"
      ],
      "obj": "CVE-2018-4878"
    },
    {
      "sub": "Adobe",
      "rel": "published an advisory concerning",
      "rel_type": [
        "other"
      ],
      "obj": "CVE-2018-4878"
    },
    {
      "sub": "CVE-2018-4878",
      "rel": "is a",
      "rel_type": [
        "categorized-as"
      ],
      "obj": "use after free"
    },
    {
      "sub": "use after free",
      "rel": "allows",
      "rel_type": [
        "leads-to"
      ],
      "obj": "Remote Code Execute"
    },
    {
      "sub": "Remote Code Execute",
      "rel": "through a",
      "rel_type": [
        "uses"
      ],
      "obj": "malformed Flash object"
    },
    {
      "sub": "KISA",
      "rel": "published an advisory about",
      "rel_type": [
        "other"
      ],
      "obj": "CVE-2018-4878"
    },
    {
      "sub": "Talos Group",
      "rel": "identified that an attacker exploited",
      "rel_type": [
        "research-describes-analysis-of-characterizes-detects"
      ],
      "obj": "CVE-2018-4878"
    },
    {
      "sub": "Group 123",
      "rel": "exploited",
      "rel_type": [
        "exploits"
      ],
      "obj": "CVE-2018-4878"
    },
    {
      "sub": "Group 123",
      "rel": "uses",
      "rel_type": [
        "uses"
      ],
      "obj": "malformed Flash object"
    },
    {
      "sub": "malformed Flash object",
      "rel": "embedded in",
      "rel_type": [
        "is-part-of"
      ],
      "obj": "Microsoft Excel document"
    },
    {
      "sub": "exploit",
      "rel": "download payload from",
      "rel_type": [
        "downloads"
      ],
      "obj": "compromised website"
    }
  ],
  "entitylist": [
    {
      "name": "CVE-2018-4878",
      "type": "vulnerability",
      "alias": [
        "Flash 0-Day",
        "Flash vulnerability"
      ],
      "mother entity": [
        "None"
      ]
    },
    {
      "name": "Group 123",
      "type": "threat-actor-or-intrusion-set",
      "alias": [
        "an attacker"
      ],
      "mother entity": [
        "None"
      ]
    },
    {
      "name": "Talos Group",
      "type": "identity",
      "alias": [
        "None"
      ],
      "mother entity": [
        "None"
      ]
    },
    {
      "name": "Adobe",
      "type": "identity",
      "alias": [
        "None"
      ],
      "mother entity": [
        "None"
      ]
    },
    {
      "name": "use after free",
      "type": "attack-pattern",
      "alias": [
        "None"
      ],
      "mother entity": [
        "None"
      ]
    },
    {
      "name": "Remote Code Execute",
      "type": "attack-pattern",
      "alias": [
        "None"
      ],
      "mother entity": [
        "None"
      ]
    },
    {
      "name": "malformed Flash object",
      "type": "file",
      "alias": [
        "Flash object"
      ],
      "mother entity": [
        "None"
      ]
    },
    {
      "name": "KISA",
      "type": "identity",
      "alias": [
        "Korean CERT"
      ],
      "mother entity": [
        "None"
      ]
    },
    {
      "name": "Microsoft Excel document",
      "type": "file",
      "alias": [
        "exploit"
      ],
      "mother entity": [
        "None"
      ]
    },
    {
      "name": "compromised website",
      "type": "infrastructure",
      "alias": [
        "None"
      ],
      "mother entity": [
        "None"
      ]
    },
    {
      "name": "exploit",
      "type": "file",
      "alias": [
        "Microsoft Excel document"
      ],
      "mother entity": []
    }
  ],
  "content": "Flash 0-Day In The Wild: Group 123 At The Controls - Cisco Blogs\nCisco Blogs / Security / Threat Research / Flash 0-Day In The Wild: Group 123 At The Controls\nFebruary 2, 2018\nThreat Research\nFlash 0-Day In The Wild: Group 123 At The Controls  Talos Group\nThe 1st of February, Adobe published an advisory concerning a Flash vulnerability (CVE-2018-4878).\nThis vulnerability is a use after free that allows Remote Code Execute through a malformed Flash object.\nAdditionally KISA (Korean CERT) published an advisory about a Flash 0-day used in the wild.\nTalos identified that an attacker exploited this vulnerability with a Flash object embedded in a Microsoft Excel document.\nBy opening the document, the exploit was executed in order to download an additional payload from a compromised website.\nRead More >>",
  "idorurl": "https://blogs.cisco.com/security/talos/flash-0-day-in-the-wild-group-123-at-the-controls"
}